{
  "$schema": "https://json-schema.org/draft/2020-12/schema",
  "title": "64x32 Scoreboard Coordinates",
  "x-indent": "  ",
  "type": "object",
  "required": ["format"],
  "properties": {
    "$schema": {
      "type": "string",
      "default": "./../schemas/coordinates/w64h32.schema.json",
      "readOnly": true,
      "x-enforceConst": true,
      "x-hidden": true
    },
    "format": {
      "type": "number",
      "const": 9.0,
      "default": 9.0,
      "x-hidden": true
    },
    "defaults": {
      "type": "object",
      "properties": {
        "font_name": { "$ref": "#/$defs/font_name" }
      }
    },
    "bases": {
      "type": "object",
      "properties": {
        "1B": { "$ref": "#/$defs/base_pos" },
        "2B": { "$ref": "#/$defs/base_pos" },
        "3B": { "$ref": "#/$defs/base_pos" }
      }
    },
    "final": {
      "type": "object",
      "properties": {
        "inning":         { "$ref": "#/$defs/point" },
        "scrolling_text": { "$ref": "#/$defs/point_width" },
        "nohit_text":     { "$ref": "#/$defs/point" }
      }
    },
    "inning": {
      "type": "object",
      "properties": {
        "break": {
          "type": "object",
          "properties": {
            "number": { "$ref": "#/$defs/point" },
            "text":   { "$ref": "#/$defs/point" },
            "due_up": {
              "type": "object",
              "properties": {
                "due":     { "$ref": "#/$defs/named_point" },
                "up":      { "$ref": "#/$defs/point" },
                "divider": {
                  "type": "object",
                  "properties": {
                    "draw":    { "type": "boolean" },
                    "x":       { "type": "integer" },
                    "y_start": { "type": "integer" },
                    "y_end":   { "type": "integer" }
                  }
                },
                "loop":    { "type": "integer" },
                "leadoff": { "$ref": "#/$defs/named_point_width" },
                "on_deck": { "$ref": "#/$defs/point_width" },
                "in_hole": { "$ref": "#/$defs/point_width" }
              }
            }
          }
        },
        "number": {
          "type": "object",
          "properties": {
            "x":             { "type": "integer" },
            "y":             { "type": "integer" },
            "nohit":         { "$ref": "#/$defs/point" },
            "perfect_game":  { "$ref": "#/$defs/point" }
          },
          "required": ["x", "y"]
        },
        "arrow": {
          "type": "object",
          "properties": {
            "size": { "type": "integer" },
            "up":   { "$ref": "#/$defs/offset" },
            "down": { "$ref": "#/$defs/offset" }
          }
        }
      }
    },
    "outs": {
      "type": "object",
      "properties": {
        "1": { "$ref": "#/$defs/out_pos" },
        "2": { "$ref": "#/$defs/out_pos" },
        "3": { "$ref": "#/$defs/out_pos" }
      }
    },
    "atbat": {
      "type": "object",
      "properties": {
        "batter": {
          "type": "object",
          "properties": {
            "x":         { "type": "integer" },
            "y":         { "type": "integer" },
            "width":     { "type": "integer" },
            "font_name": { "$ref": "#/$defs/font_name" },
            "offset":    { "type": "integer" }
          },
          "required": ["x", "y", "width"]
        },
        "pitcher": {
          "type": "object",
          "properties": {
            "x":         { "type": "integer" },
            "y":         { "type": "integer" },
            "width":     { "type": "integer" },
            "font_name": { "$ref": "#/$defs/font_name" }
          },
          "required": ["x", "y", "width"]
        },
        "pitch": {
          "type": "object",
          "properties": {
            "font_name":   { "$ref": "#/$defs/font_name" },
            "x":           { "type": "integer" },
            "y":           { "type": "integer" },
            "enabled":     { "type": "boolean" },
            "mph":         { "type": "boolean" },
            "desc_length": { "$ref": "#/$defs/desc_length" }
          }
        },
        "pitch_count": {
          "type": "object",
          "properties": {
            "font_name":             { "$ref": "#/$defs/font_name" },
            "x":                     { "type": "integer" },
            "y":                     { "type": "integer" },
            "enabled":               { "type": "boolean" },
            "append_pitcher_name":   { "type": "boolean" }
          }
        },
        "loop":        { "type": "integer" },
        "strikeout":   { "$ref": "#/$defs/play_display" },
        "play_result": { "$ref": "#/$defs/play_display" }
      }
    },
    "batter_count": {
      "type": "object",
      "properties": {
        "x":             { "type": "integer" },
        "y":             { "type": "integer" },
        "nohit":         { "$ref": "#/$defs/point" },
        "perfect_game":  { "$ref": "#/$defs/point" }
      },
      "required": ["x", "y"]
    },
    "nohitter": {
      "type": "object",
      "properties": {
        "x":                    { "type": "integer" },
        "y":                    { "type": "integer" },
        "innings_until_display": { "type": "integer" }
      }
    },
    "pregame": {
      "type": "object",
      "properties": {
        "scrolling_text": {
          "type": "object",
          "properties": {
            "x":      { "type": "integer" },
            "y":      { "type": "integer" },
            "width":  { "type": "integer" },
            "warmup": { "$ref": "#/$defs/point_width" }
          },
          "required": ["x", "y", "width"]
        },
        "start_time":  { "$ref": "#/$defs/point" },
        "warmup_text": { "$ref": "#/$defs/point" }
      }
    },
    "standings": {
      "type": "object",
      "properties": {
        "font_name":  { "$ref": "#/$defs/font_name" },
        "start":      { "type": "integer" },
        "offset":     { "type": "integer" },
        "height":     { "type": "integer" },
        "width":      { "type": "integer" },
        "divider":    { "$ref": "#/$defs/x_pos" },
        "stat_title": { "$ref": "#/$defs/x_pos" },
        "team": {
          "type": "object",
          "properties": {
            "name":       { "$ref": "#/$defs/x_pos" },
            "record":     { "$ref": "#/$defs/x_pos" },
            "games_back": { "$ref": "#/$defs/x_pos" }
          }
        },
        "postseason": {
          "type": "object",
          "properties": {
            "matchup_y_gap": { "type": "integer" },
            "series_x_gap":  { "type": "integer" },
            "wc_x_start":    { "type": "integer" },
            "wc_y_start":    { "type": "integer" },
            "ds_a_y_start":  { "type": "integer" },
            "__comment":     { "type": "string" }
          }
        }
      }
    },
    "status": {
      "type": "object",
      "properties": {
        "text": {
          "type": "object",
          "properties": {
            "x":          { "type": "integer" },
            "y":          { "type": "integer" },
            "short_text": { "type": "boolean" }
          },
          "required": ["x", "y"]
        },
        "scrolling_text": { "$ref": "#/$defs/point_width" }
      }
    },
    "teams": {
      "type": "object",
      "properties": {
        "background": { "$ref": "#/$defs/team_pair_rect" },
        "accent":     { "$ref": "#/$defs/team_pair_rect" },
        "name": {
          "type": "object",
          "properties": {
            "away":      { "$ref": "#/$defs/named_point" },
            "home":      { "$ref": "#/$defs/named_point" },
            "full":      { "type": "boolean" },
            "font_name": { "$ref": "#/$defs/font_name" }
          },
          "required": ["away", "home"]
        },
        "record": {
          "type": "object",
          "properties": {
            "enabled":  { "type": "boolean" },
            "position": { "type": "string" },
            "away":     { "$ref": "#/$defs/named_point" },
            "home":     { "$ref": "#/$defs/named_point" }
          }
        },
        "line_score": {
          "type": "object",
          "properties": {
            "away":                                  { "$ref": "#/$defs/named_point" },
            "home":                                  { "$ref": "#/$defs/named_point" },
            "show_hits_and_errors":                  { "type": "boolean" },
            "compress_digits":                       { "type": "boolean" },
            "shorten_team_name_on_high_line_score":  { "type": "boolean" },
            "spacing":                               { "type": "integer" },
            "font_name":                             { "$ref": "#/$defs/font_name" }
          }
        }
      }
    },
    "offday": {
      "type": "object",
      "properties": {
        "scrolling_text": { "$ref": "#/$defs/point_width" },
        "time":           { "$ref": "#/$defs/point" },
        "conditions":     { "$ref": "#/$defs/point" },
        "temperature":    { "$ref": "#/$defs/point" },
        "wind_speed":     { "$ref": "#/$defs/point" },
        "wind_dir":       { "$ref": "#/$defs/point" },
        "wind":           { "$ref": "#/$defs/point" },
        "weather_icon": {
          "type": "object",
          "properties": {
            "x":            { "type": "integer" },
            "y":            { "type": "integer" },
            "width":        { "type": "integer" },
            "height":       { "type": "integer" },
            "rescale_icon": { "type": "integer" }
          },
          "required": ["x", "y", "width", "height"]
        }
      }
    },
    "network": {
      "type": "object",
      "properties": {
        "font_name":  { "$ref": "#/$defs/font_name" },
        "background": { "$ref": "#/$defs/rect" },
        "text":       { "$ref": "#/$defs/point" }
      }
    }
  },
  "$defs": {
    "font_name": {
      "type": "string",
      "description": "Font name used to render this element"
    },
    "desc_length": {
      "type": "string",
      "enum": ["short", "medium", "long"]
    },
    "point": {
      "type": "object",
      "properties": {
        "x": { "type": "integer" },
        "y": { "type": "integer" }
      },
      "required": ["x", "y"]
    },
    "point_width": {
      "type": "object",
      "properties": {
        "x":     { "type": "integer" },
        "y":     { "type": "integer" },
        "width": { "type": "integer" }
      },
      "required": ["x", "y", "width"]
    },
    "named_point": {
      "type": "object",
      "properties": {
        "x":         { "type": "integer" },
        "y":         { "type": "integer" },
        "font_name": { "$ref": "#/$defs/font_name" }
      },
      "required": ["x", "y"]
    },
    "named_point_width": {
      "type": "object",
      "properties": {
        "x":         { "type": "integer" },
        "y":         { "type": "integer" },
        "width":     { "type": "integer" },
        "font_name": { "$ref": "#/$defs/font_name" }
      },
      "required": ["x", "y", "width"]
    },
    "rect": {
      "type": "object",
      "properties": {
        "x":      { "type": "integer" },
        "y":      { "type": "integer" },
        "width":  { "type": "integer" },
        "height": { "type": "integer" }
      },
      "required": ["x", "y", "width", "height"]
    },
    "base_pos": {
      "type": "object",
      "properties": {
        "x":    { "type": "integer" },
        "y":    { "type": "integer" },
        "size": { "type": "integer" }
      },
      "required": ["x", "y", "size"]
    },
    "out_pos": {
      "type": "object",
      "properties": {
        "x":             { "type": "integer" },
        "y":             { "type": "integer" },
        "size":          { "type": "integer" },
        "nohit":         { "$ref": "#/$defs/base_pos" },
        "perfect_game":  { "$ref": "#/$defs/base_pos" }
      },
      "required": ["x", "y", "size"]
    },
    "x_pos": {
      "type": "object",
      "properties": {
        "x": { "type": "integer" }
      },
      "required": ["x"]
    },
    "offset": {
      "type": "object",
      "properties": {
        "x_offset": { "type": "integer" },
        "y_offset": { "type": "integer" }
      },
      "required": ["x_offset", "y_offset"]
    },
    "play_display": {
      "type": "object",
      "properties": {
        "x":           { "type": "integer" },
        "y":           { "type": "integer" },
        "font_name":   { "$ref": "#/$defs/font_name" },
        "desc_length": { "$ref": "#/$defs/desc_length" },
        "enabled":     { "type": "boolean" }
      },
      "required": ["x", "y"]
    },
    "team_pair_rect": {
      "type": "object",
      "properties": {
        "away": { "$ref": "#/$defs/rect" },
        "home": { "$ref": "#/$defs/rect" }
      },
      "required": ["away", "home"]
    }
  },
  "default": {
    "$schema": "./../schemas/coordinates/w64h32.schema.json",
    "format": 9.0,
    "defaults": {
      "font_name": "4x6"
    },
    "bases": {
      "1B": { "x": 56, "y": 20, "size": 6 },
      "2B": { "x": 51, "y": 15, "size": 6 },
      "3B": { "x": 46, "y": 20, "size": 6 }
    },
    "final": {
      "inning":         { "x": 32, "y": 20 },
      "scrolling_text": { "x": 0,  "y": 31, "width": 64 },
      "nohit_text":     { "x": 1,  "y": 20 }
    },
    "inning": {
      "break": {
        "number": { "x": 2, "y": 29 },
        "text":   { "x": 2, "y": 22 },
        "due_up": {
          "due":     { "x": 18, "y": 22 },
          "up":      { "x": 18, "y": 28 },
          "divider": { "draw": true, "x": 15, "y_start": 14, "y_end": 32 },
          "loop":    64,
          "leadoff": { "x": 32, "y": 20, "width": 32 },
          "on_deck": { "x": 32, "y": 26, "width": 32 },
          "in_hole": { "x": 32, "y": 32, "width": 32 }
        }
      },
      "number": {
        "x": 46, "y": 21,
        "nohit":        { "x": 46, "y": 20 },
        "perfect_game": { "x": 46, "y": 20 }
      },
      "arrow": {
        "size": 3,
        "up":   { "x_offset": -5, "y_offset": -4 },
        "down": { "x_offset": -5, "y_offset": -2 }
      }
    },
    "outs": {
      "1": { "x": 49, "y": 28, "size": 2 },
      "2": { "x": 53, "y": 28, "size": 2 },
      "3": { "x": 57, "y": 28, "size": 2 }
    },
    "atbat": {
      "batter":      { "x": 1,  "y": 29, "width": 20 },
      "pitcher":     { "x": 1,  "y": 21, "width": 24 },
      "pitch":       { "x": 1,  "y": 50, "enabled": false, "mph": false, "desc_length": "short" },
      "pitch_count": { "x": 1,  "y": 50, "enabled": false, "append_pitcher_name": false },
      "loop": 36,
      "strikeout":   { "x": 15, "y": 29, "font_name": "5x7", "desc_length": "short", "enabled": true },
      "play_result": { "x": 15, "y": 29, "font_name": "5x7", "desc_length": "short", "enabled": true }
    },
    "batter_count": {
      "x": 34, "y": 30,
      "nohit":        { "x": 34, "y": 32 },
      "perfect_game": { "x": 34, "y": 32 }
    },
    "nohitter": { "x": 34, "y": 26, "innings_until_display": 5 },
    "pregame": {
      "scrolling_text": { "x": 0, "y": 31, "width": 64, "warmup": { "x": 0, "y": 31, "width": 64 } },
      "start_time":     { "x": 32, "y": 20 },
      "warmup_text":    { "x": 32, "y": 20 }
    },
    "standings": {
      "offset": 6,
      "height": 30,
      "width":  64,
      "divider":    { "x": 13 },
      "stat_title": { "x": 28 },
      "team": {
        "name":       { "x": 1  },
        "record":     { "x": 31 },
        "games_back": { "x": 64 }
      },
      "postseason": {
        "matchup_y_gap": 6,
        "series_x_gap":  16,
        "wc_x_start":    2,
        "wc_y_start":    6,
        "ds_a_y_start":  25,
        "__comment":     "all other coords are based off wild card position"
      }
    },
    "status": {
      "text":           { "x": 32, "y": 20, "short_text": false },
      "scrolling_text": { "x": 0,  "y": 31, "width": 64 }
    },
    "teams": {
      "background": {
        "away": { "width": 64, "height": 7, "x": 0, "y": 0 },
        "home": { "width": 64, "height": 7, "x": 0, "y": 7 }
      },
      "name": {
        "away": { "x": 4, "y": 6  },
        "home": { "x": 4, "y": 13 },
        "full": true
      },
      "accent": {
        "away": { "width": 2, "height": 7, "x": 0, "y": 0 },
        "home": { "width": 2, "height": 7, "x": 0, "y": 7 }
      },
      "record": {
        "enabled":  false,
        "position": "absolute",
        "away": { "x": 15, "y": 6  },
        "home": { "x": 15, "y": 13 }
      },
      "line_score": {
        "away": { "x": 62, "y": 6  },
        "home": { "x": 62, "y": 13 },
        "show_hits_and_errors": true,
        "compress_digits": false,
        "shorten_team_name_on_high_line_score": true,
        "spacing": 3
      }
    },
    "offday": {
      "scrolling_text": { "x": 0,  "y": 30, "width": 64 },
      "time":           { "x": 40, "y": 8  },
      "conditions":     { "x": 40, "y": 16 },
      "temperature":    { "x": 10, "y": 23 },
      "wind_speed":     { "x": 0,  "y": -2 },
      "wind_dir":       { "x": 0,  "y": -2 },
      "wind":           { "x": 40, "y": 23 },
      "weather_icon":   { "x": 2,  "y": 1, "width": 15, "height": 15 }
    },
    "network": {
      "font_name":  "4x6",
      "background": { "width": 7, "height": 7, "x": 57, "y": 25 },
      "text":       { "x": 61, "y": 31 }
    }
  }
}
